{
  "account_id": "11111111-1111-4111-8111-111111111111",
  "schema_version": "1.0",
  "created_at": "2026-01-01T00:00:00Z",
  "updated_at": "2026-01-10T00:00:00Z",
  "home_country": "US",
  "kyc_level": "STANDARD",
  "customer_risk_tier": "LOW",
  "normal_transaction_amount_usd": 250.0,
  "normal_transaction_frequency_per_day": 2.0,
  "preferred_assets": [
    "BTC",
    "ETH"
  ],
  "account_status": "ACTIVE"
}
